{
  "schema_version": "1.0",
  "registry_id": "biomedical-analysis-agent-p0-teaching-cases",
  "distribution": "public-core-metadata-only",
  "audit_date": "2026-07-19",
  "maturity_policy": "candidate-only; execution is required before fixture-verified or data-verified promotion",
  "cases": [
    {
      "case_id": "p0-visualization-kinneyh-composition",
      "domain": "visualization",
      "title": "KinneyH cell annotation composition negative-control figure",
      "purpose": "Use a real 56,179-cell annotation table to detect percentage, axis-label and label-collision failures, then plan scientifically bounded sample-level composition figures; donor-aware inference requires a separately verified donor-sample mapping.",
      "current_status": "candidate-local-audited",
      "execution_status": "not-executed",
      "maturity": "normalized",
      "availability": {
        "status": "available-local",
        "audited_on": "2026-07-19",
        "local_locator_refs": ["local:p0.visualization.kinneyh.annotation-summary"],
        "integrity_evidence": [
          {
            "locator_ref": "local:p0.visualization.kinneyh.annotation-summary",
            "role": "cell-level annotation and QC table",
            "sha256": "a23d8b5fd5c6faa85a2a852a9cbeebe449acab2576092f03ecc8f1cb4358e27e",
            "size_bytes": 5862162
          }
        ],
        "total_size_bytes": 5862162,
        "evidence_scope": "One CSV was opened read-only; header and 56,179 data rows across five sample IDs were confirmed. Existing plots were not accepted as reference truth."
      },
      "data_contract": [
        {
          "artifact_id": "kinneyh-cell-annotation-summary",
          "role": "cell-level annotations, sample IDs and QC covariates",
          "formats": ["csv"],
          "availability": "available-local",
          "locator_refs": ["local:p0.visualization.kinneyh.annotation-summary"],
          "observation_unit": "cell",
          "feature_unit": "annotation and QC fields",
          "expected_shape": "56,179 rows x 18 columns; five sample IDs",
          "required_metadata": ["sample_id", "cell_type", "batch"]
        }
      ],
      "statistical_contract": {
        "measurement_unit": "cell",
        "biological_replicate": "not established; sample_id is a descriptive grouping variable and cannot be assumed to equal donor_id",
        "inference_unit": "unresolved until donor-sample mapping and independence are verified; no cell-level or sample-level inferential test",
        "estimand": "per-sample cell-type composition; descriptive only because no case-control contrast is registered",
        "pseudoreplication_guard": "Aggregate counts and proportions by sample before any uncertainty or group comparison; never treat 56,179 cells as independent donors.",
        "missingness_policy": "Report missing sample_id/cell_type values and exclude only with an explicit count ledger."
      },
      "workflow_plan": {
        "allowed_mode": "reproduce-figure",
        "stages": [
          {
            "stage_id": "profile-input",
            "purpose": "Validate columns, row count, sample count, missingness and category levels.",
            "depends_on": [],
            "inputs": ["kinneyh-cell-annotation-summary"],
            "outputs": ["input-profile.json", "category-ledger.tsv"],
            "checkpoint_id": "cp-input-profile"
          },
          {
            "stage_id": "derive-composition",
            "purpose": "Build sample-by-cell-type counts and within-sample proportions with exact denominator checks.",
            "depends_on": ["profile-input"],
            "inputs": ["category-ledger.tsv"],
            "outputs": ["composition-counts.tsv", "composition-proportions.tsv"],
            "checkpoint_id": "cp-composition-table"
          },
          {
            "stage_id": "render-variants",
            "purpose": "Plan stacked bars and sample-level distribution alternatives without changing the descriptive estimand.",
            "depends_on": ["derive-composition"],
            "inputs": ["composition-proportions.tsv"],
            "outputs": ["figure-variants", "figure-semantics.json"],
            "checkpoint_id": "cp-figure-variants"
          },
          {
            "stage_id": "native-review",
            "purpose": "Review percent sums, axis semantics, color discrimination, labels and unsupported claims.",
            "depends_on": ["render-variants"],
            "inputs": ["figure-variants", "figure-semantics.json"],
            "outputs": ["FIGURE_NOTES.md", "visual-qa.json"],
            "checkpoint_id": "cp-native-review"
          }
        ],
        "optional_branches": ["donor-level dot or interval plot only after donor-sample mapping, donor independence and a valid grouping variable are verified"]
      },
      "environment": {
        "backends": ["python"],
        "isolation": "task-scoped-new-lock",
        "install_authorized": false,
        "dependencies": [
          {"name": "pandas", "manager": "pypi", "version_policy": "freeze probed compatible version", "probe_status": "installed", "probed_version": "2.3.3"},
          {"name": "matplotlib", "manager": "pypi", "version_policy": "freeze probed compatible version", "probe_status": "installed", "probed_version": "3.10.8"},
          {"name": "seaborn", "manager": "pypi", "version_policy": "freeze probed compatible version", "probe_status": "installed", "probed_version": "0.13.2"}
        ],
        "freeze_required_before_run": true
      },
      "checkpoints": [
        {"checkpoint_id": "cp-input-profile", "after_stage": "profile-input", "artifacts": ["input-profile.json", "category-ledger.tsv"], "validation": ["CSV hash matches registry", "required columns exist", "row and sample counts are recorded"]},
        {"checkpoint_id": "cp-composition-table", "after_stage": "derive-composition", "artifacts": ["composition-counts.tsv", "composition-proportions.tsv"], "validation": ["each sample proportion sums to 1 within tolerance", "counts reconcile to retained cells"]},
        {"checkpoint_id": "cp-figure-variants", "after_stage": "render-variants", "artifacts": ["figure-variants", "figure-semantics.json"], "validation": ["axis units match mapped data", "variants preserve the same descriptive estimand"]},
        {"checkpoint_id": "cp-native-review", "after_stage": "native-review", "artifacts": ["FIGURE_NOTES.md", "visual-qa.json"], "validation": ["native images reviewed", "supported and unsupported claims recorded"]}
      ],
      "acceptance_criteria": [
        "Every sample's stacked composition sums to 100% within numerical tolerance.",
        "Axes and legends identify percent, sample and cell type without contradictory labels.",
        "No inferential or condition-effect claim is made from cell-level counts.",
        "Figure notes explicitly document the known over-100%, wrong-axis and label-overlap negative controls."
      ],
      "governance": {
        "data_classification": "public-research-candidate",
        "human_data": true,
        "deidentification_status": "public-deidentified",
        "source_identifiers": ["GSE185948", "GSM5627690-GSM5627694"],
        "license_status": "pending",
        "redistribution_status": "pending",
        "citation_status": "verified",
        "required_action": "Resolve dataset redistribution and reuse terms before packaging any data; retain the verified GSE185948/PMID 36310237 citation."
      },
      "blockers": [
        {"code": "no-valid-group-contrast", "severity": "warning", "description": "The registered table has five samples but no validated inferential contrast.", "resolution": "Use descriptive composition only or register condition metadata and an estimand in a new WorkflowInstance."},
        {"code": "reference-plot-invalid", "severity": "blocking", "description": "Prior plots include stacks above 100%, an incorrect axis label and overlapping pie labels.", "resolution": "Treat them as negative controls, recompute denominators and complete native visual review."}
      ],
      "claim_ceiling": "Supports teaching and auditing descriptive sample-level composition visualization; it cannot establish disease-associated composition changes.",
      "next_allowed_action": "Compile a reproduce-figure plan; execution still requires explicit run authorization and a frozen task environment."
    },
    {
      "case_id": "p0-single-cell-gse185948",
      "domain": "single-cell",
      "title": "GSE185948 five-donor healthy kidney 10x snRNA-seq",
      "purpose": "Exercise nuclear-count import, donor-preserving nucleus-aware QC, integration choice, clustering and annotation while preventing nucleus-level pseudoreplication and forced labels.",
      "current_status": "candidate-local-audited",
      "execution_status": "not-executed",
      "maturity": "normalized",
      "public_metadata": {
        "metadata_id": "p0-single-cell-gse185948-public-metadata",
        "path": "p0-single-cell-gse185948-metadata.json",
        "sha256": "32794f6119df63e811accb41a823788e4d5b98b3d8ec94a4313818ae19925a93"
      },
      "availability": {
        "status": "available-local",
        "audited_on": "2026-07-19",
        "local_locator_refs": [
          "local:p0.snrna.gse185948.gsm5627690",
          "local:p0.snrna.gse185948.gsm5627691",
          "local:p0.snrna.gse185948.gsm5627692",
          "local:p0.snrna.gse185948.gsm5627693",
          "local:p0.snrna.gse185948.gsm5627694"
        ],
        "integrity_evidence": [
          {"locator_ref": "local:p0.snrna.gse185948.gsm5627690", "role": "10x filtered nucleus feature-barcode matrix; Healthy1/cont1", "sha256": "bc4f985540176f7acc49b01bc99b8c32b75d6efc424943dd239155433ce9fc99", "size_bytes": 26385307},